C1: I. TAXONOMY

A1: Back to Animals | B1: Back to Osteichthyes | C1: Back to Alphabetized Species List | D1: Back to Completed Reports List

A1: Species Name: | B1: Pomatomus saltatrix
A2: Common Name: | B2: (Bluefish)

A1: Kingdom | B1: Phylum/Division: | C1: Class: | D1: Order: | E1: Family: | F1: Genus:
A2: Animalia | B2: Chordata | C2: Osteichthyes | D2: Perciformes | E2: Pomatomidae | F2: Pomatomus

A1: The Bluefish, Pomatomus saltatrix. Illustration by Diana Rome Peebles 1998. Courtesy of Florida Fish and Wildlife Conservation Commission, Division of Marine Fisheries. | B1: Species Name: Pomatomus saltatrix (Linnaeus, 1766) Common Name: Bluefish Synonymy: None

A1: Other Taxonomic Groupings: Superclass: Osteichthyes Class: Actinopterygii The bluefish is the only living member of the family Pomatomidae, and is closely related to the jacks and pompanos of the family Carangidae. Potentially Misidentified Species: None. Species Description: Pomatomus saltatrix is an oblong, laterally compressed and streamlined predatory species that reaches 1m (3.3 feet) in total length (TL). Older juveniles and adult fishes tend to segregate into schools of similarly sized individuals (Olla and Studholme 1971; Wilk 1977). The head is large and compressed with the mouth set obliquely. The maxilla extends to the rear of the eye. The lower jaw projects from the mouth and has a row of long, unequal teeth on each side. The tongue, vomer, and palatine bones of the head all have bands of villiform teeth. Body color is bluish to greenish dorsally, fading to silver ventrally. The only obvious markings on the body surface occur at the bases of the pectoral fins, which are each blotched with a small dark patch. Ctenoid scales cover the opercule, cheek, and body, but not the top of the head or a ridge that runs above the cheeks. Ninety-five scales run along the lateral line. The spinous portion of the dorsal fin has 8 - 9 spines and is separated by a notch from the soft dorsal fin, which has 24- 25 soft rays. The anal fin reflects the soft dorsal fin, though it originates somewhat posterior to the dorsal fin, and has 2-3 small spines and 26-28 soft rays. The pectoral fins are set low on the body, with the pelvic fins set directly inferior to them. (Oliver et al. 1989; Pottern et al. 1989). Bluefish can be harmful and are reported to bite when handled. II. HABITAT AND DISTRIBUTION Regional Occurrence: The bluefish has a nearly worldwide range in temperate and tropical waters around continental shelves and estuaries. It is absent only from the northern and central Pacific Ocean. In the Western Atlantic, it occurs from Nova Scotia south through Brazil, Uruguay and Argentina, including Bermuda, the Gulf of Mexico, the Bahamas, and northern Cuba (Oliver et al. 1989; Pottern et al. 1989). IRL Distribution: Bluefish can be seasonally abundant along the coast of Florida (Oliver et al. 1989), especially in late fall and winter when overwintering fish migrate to the east coast of Florida. During this time, bluefish can be common within the Indian River Lagoon, especially in the vicinity of inlets. III. LIFE HISTORY AND POPULATION BIOLOGY Age, Size, Lifespan: Pomatomus saltatrix grows to a maximum size of 130 cm TL (4.3 feet) (Randall 1995), and a maximum weight of 14.4 kg (31.7 pounds) (Intl. Game Fish Assoc. 1991). They live approximately 9 - 11 years. Males and females grow at approximately the same rates (Richards 1976). Two distinct stocks of bluefish occur along the Atlantic coast of the U.S. One stock spawns in late summer in the waters of the continental shelf between Cape Cod and Cape Hatteras, NC. The other spawns in early spring along the edge of the Gulf Stream between North Carolina and northern Florida. The stocks are physically distinguished using multivariate morphometric analyses and by differences in growth patterns on the scales. (Lassiter 1962; Kendall and Walford 1979). Yearlings of the spring-spawning group, when compared to the summer-spawning group, were shown to have somewhat larger heads, eyes, pectoral fins and longer maxillae; and relatively shorter dorsal, anal, and ventral fins (Wilk 1977). There is also a Gulf of Mexico stock that is apparently somewhat less migratory than those that occur along the eastern seaboard. However, genetic analysis revealed that Gulf of Mexico bluefish mix at least occasionally with those in south Florida such that they can be considered as one stock (Graves et al. 1993). Abundance: The bluefish is abundant, especially in fall and winter in Florida waters. In the Carolinas it is ranked as the #1 gamefish of recreational anglers. In Florida, anglers often harvest more pounds of bluefish than commercial enterprises. Bluefish travel offshore in large schools following schools of baitfishes and other smaller prey species. Juveniles also school in large numbers, but tend to remain in shallow coastal waters or in estuaries. They later migrate in fall and winter to join adults offshore for migration to Florida waters. Locomotion: Bluefish passively ventilate their gills when swimming at speeds above 4 - 4.6 body lengths per second. Below this rate, the gills are ventilated by actively pumping the operculum. In laboratory studies, Olla et al. (1975) acclimated a captive bluefish population measuring 45 - 55 cm (1.5 - 1.8 feet) at 20°C, which approximately corresponds to conditions in the Mid-Atlantic bight at the time of summer spawning. Olla et al. (1975) reported that bluefish under these conditions swam in daylight at a rate of approximately 50cm (1.6 feet) per second. At night, this rate was reduced to 50 cm (0.5 feet) per second. Reproduction: Several geographic races of bluefish are recognized (Lund 1961). However, based on mtDNA analyses and tagging information, Atlantic coast bluefishes and those that occur in the Gulf of Mexico mix often enough to be considered as a single genetic stock (Graves et al. 1993). Pomatomus saltatrix mature sexually during the second year upon reaching approximately 35 - 45 cm (1.15 - 1.48 feet) fork length (FL), with males maturing somewhat earlier than females (Wilk 1977). Fecundity of 3-4 year old females ranged from 0.6 - 1.4 million eggs (Lippson and Moran 1974). The south Atlantic, spring-spawning stock of bluefish reproduces primarily in April and May at the interface of the continental slope and the edge of the Gulf Stream between Cape Hatteras, NC and northern Florida (Wilk 1977). The mid-Atlantic stock of bluefish spawns in summer from May through September in outer continental shelf waters approximately 50 - 150 km offshore between Cape Cod and Cape Hatteras, NC (Lund and Maltezos 1970; Kendall and Walford 1979). Norcross et al. (1974) reported that over 80% of the bluefish eggs they collected were taken more than 55 km offshore. Spent bluefish in the Middle Atlantic tend to move inshore to Bays and estuaries throughout July and August. Embryology: Eggs are buoyant, spherical and measure 0.9 - 1.2 mm in diameter. The membrane is smooth and transparent, with amber-colored yolk and a single darker colored oil globule measuring approximately 0.3 mm in diameter. Eggs hatch after 46 - 48 hours into larvae measuring 2.0 - 2.4 mm in total length (TL) (Deuel et al. 1966; Kendall and Walford 1979). In newly hatched larvae, the yolk sac comprises over half of body length and melanophores are scattered along the head and back. Four days after hatching, the yolk is nearly entirely absorbed, the mouth is developed and pigment bands begin to emerge mid-dorsally and mid-ventrally. Fin rays can be seen when larvae reach approximately 6.0 mm TL, and are fully developed at 13 -14 mm TL. At this size, larvae resemble adults in overall body form and meristic counts, except that the head appears disproportionately large (Norcross et al. 1974; Lippson and Moran 1974). Larvae feed on plankton in surface waters until they metamorphose and begin to migrate back to estuaries and other coastal nursery areas. (Kendall and Walford 1979). Larval development takes place on outer continental shelf, generally in the upper 6m of surface waters (Kendall and Walford 1979). Larvae demonstrate diel vertical migration, concentrating at depths of approximately 4m (13 feet) around midday, and at the surface during the evening hours. IV. PHYSICAL TOLERANCES Temperature: Water temperature and photoperiod are major factors that influence movement patterns in bluefish (Olla and Studholme 1971; Wilk 1977). Spawning in the mid-Atlantic region occurs at temperatures of 17 - 24°C, while in the south Atlantic region, it occurs at 24 - 26 °C. (Norcross et al 1974; Kendall and Walford 1979). Bluefish smaller than 250 mm (9.8 inches) TL require temperatures above 10°C for survival, however larger fishes and adults can withstand short exposure to temperatures as low as 7.5°C (Lund and Maltezos 1970; Wilk 1977). Under laboratory conditions, adult bluefishes survived temperatures up to 30.4°C (Olla and Studholme 1975). Loss of equilibrium was observed at a temperature of 35°C (Olla et al. 1975). Olla et al. (1975) examined responses of bluefish to thermal stressors. At stress temperatures of 12°C as a thermal minimum, and 30°C as a thermal maximum, swimming speeds in their aquarium population increased to more than 3 times the acclimation rate, and were maintained. The schools stopped feeding, and did not separate at night. These results were interpreted as avoidance behavior, with the schools apparently attempting to swim to more favorable areas. Like some other large, pelagic species such as tunas, bluefish have the ability to maintain their body temperatures as much as 4°C above ambient water temperatures. Salinity: Bluefish are considered to tolerate moderately euryhaline conditions as both juveniles and as adults. They are known to enter estuaries where salinity is less than 10 ppt (Lippson and Lippson 1979). During spawning, salinity in the mid-Atlantic region is approximately 30 - 32 parts per thousand (ppt). During the south Atlantic spawning period, salinity is generally 35-38 ppt (Norcross et al 1974; Kendall and Walford 1979). Dissolved Oxygen: As a pelagic, open water species, the bluefish is not well adapted for hypoxic conditions. Swanson and Sinderman (1979), in the summer of 1976, studied a large mass of hypoxic water that developed off the coast of northern New Jersey. While small bluefishes that tend to migrate close to the shoreline, and large fishes that tend to remain offshore, appeared in Connecticut and Long Island at the usual time of year, mid-sized fishes were generally absent throughout the summer, thought to have been stopped by the low oxygen conditions and perhaps to have reversed direction, returning to the waters of southern New Jersey and Delaware. Other Physical Tolerances: Though they occur primarily on the continental shelf, the bluefish is able to secrete gases into its swim bladder at the fastest rate known for any fish, thus allowing it to change depth quickly (Bentley and Wiley 1982). V. COMMUNITY ECOLOGY Trophic Mode: Pomatomus saltatrix are opportunistic, visual, predators whose diet reflects the availability of prey species (Naughton and Saloman 1984). Larvae prey primarily copepods, cladocerans, and invertebrate eggs (Kendall and Naplin 1981). Juvenile bluefish prey on small shrimp, anchovies, killifishes, crabs and silversides (Pottern et al. 1989). Older juveniles and adults prey on schooling fishes, some of which include: croakers, striped mullet, menhaden, sardines, Atlantic bumper and round scad. Invertebrate prey includes small portunid crabs, penaeid shrimps, squid and gastropods. Kendall and Naplin (1981) reported that the diet of a juvenile bluefish consists of approximately 18% invertebrates, mostly penaeid shrimp and squid; and 82% vertebrates, primarily pinfish (Lagodon rhomboides) and silversides (Menida spp.). As juveniles grow, invertebrates become less important in the diet and can be entirely eliminated in favor of small, schooling fishes (Lassiter 1962). Naughton and Saloman (1984) reported the food habits of bluefishes captured in North and South Carolina showed a distinct preference for other bluefish, as well as for members of the Sciaenidae, Clupeidae, Mugilidae and Engraulidae as preferred prey. Feeding activity peaks in early morning and continues throughout daylight hours (Lund and Maltezos 1970). Under laboratory conditions, schools were observed breaking up as prey were pursued, with schools reforming after all prey had been consumed. Interestingly, Olla et al. (1970) found that prey size motivates feeding in bluefish. Captive bluefish fed to satiation on small prey immediately resumed feeding when larger prey of the same species were offered. Only large predators such as sharks, swordfishes, wahoo, and tunas are known to prey on bluefishes. Competitors: Possible competitors of bluefish include the king mackerel, Spanish mackerel, weakfish, striped bass, bonito and little tunny (Manooch 1984). Activity Time: As visual predators, bluefish are most active during the daylight hours. Activity increases at daybreak and continues increasing until midday. Thereafter, activity begins to gradually decline until 1-2 hours after dark when slower night time activity resumes (Lund and Maltezos 1970; Olla and Studholme 1972). Habitats: Bluefish are a migratory, pelagic species that are dependent on both continental shelf waters and estuaries for spawning and nursery areas respectively. Adults are found at depths of 2 - 200m (6.6 - 219 feet). In inshore areas, they tend to be most common along high energy beaches, but can also be common in estuaries and, sometimes, in brackish water areas. Small fish are common in shallow coastal waters where depths exceed 2m (6.6 feet). VI. SPECIAL STATUS Special Status: None. Fisheries Importance: COMMERCIAL FISHERY: The bluefish is an important commercial and recreational species along nearly the entire east coast. In the southern states, from North Carolina through Florida, the recreational catch can exceed the commercial catch. The statewide commercial catch of Pomatomus saltatrix between the years 1987 - 2001 was 15.3 million pounds, with a dollar value of over $4.5 million. Within the 5-county area encompassing the IRL (Volusia, Brevard, Indian River, St. Lucie and Martin Counties) the commercial catch of Pomatomus saltatrix accounts for approximately 58% of the statewide total, with a harvest of 8.9 million pounds, and a value in excess of $2.6 million. This ranks the bluefish twenty-first in commercial value to IRL counties, and tenth in pounds harvested. Figure 1 below shows the dollar value of the bluefish fishery to IRL counties by year. As shown, commercial catch ranged from a low of $43,077 in 2001 to a high of over $342,328 in 1993. Of interest is the drastic reduction in the commercial catch following the 1995 banning of gill nets from Florida waters. This trend is reflective of both the gill net ban and a reduced number of commercial fishers. Muller (2001) reported that the number of commercial fishers was reduced from 347 in 1984 - 1994 to an average of 127 following the gill net ban. Martin and St. Lucie Counties account for the bulk of the commercial harvest, with 38.8% and 31.9% of the catch respectively (Figure 2, Table 3). From 1987 - 2001, the annual dollar value to Martin County ranged from $151,650 in 1987, dropping to only $6,046 in 2001, with an annual average of $66,727. In St. Lucie county, the annual dollar amount ranged from a high of $114,217 in 1993 to a low of $3,966 in 1997, with an annual average of $54,832. Of note is the trend in the data that suggests that while the fishery in the Martin County area declined to $3,000 - $6,000 annually after 1999, harvests in St. Lucie County and Brevard County were much stronger. Figure 1. Annual dollar value of the commercial catch of bluefish to the 5-county area of the Indian River Lagoon. Figure 2. Total bluefish dollar value and percentage by county for the years 1987 - 2001. Table 1. Total dollar value of IRL bluefish, Pomatomus saltatrix, between 1987 - 2001. Table 2. By-county annual and cumulative percentages of the bluefish harvest for the years 1987-2001. Table 3. By-county cumulative dollar value and percentage of total for the bluefish harvest from 1987 - 2001. RECREATIONAL FISHERY: Throughout Florida, recreational landings of bluefish are often significantly higher than commercial landings. In 2000, recreational landings of bluefish statewide were 6 times higher than commercial landings. Angler survey information shows that while the bag limit of 10 bluefish per trip is observed by the vast majority of anglers, the minimum size limit is not complied with as often. Muller (2001) reported in a bluefish stock assessment that 31% of bluefish harvested recreationally in 2001 were sublegal. However, the bluefish stock Figures 3 and 4 below show the recreational harvest of bluefish based on angler surveys from the 5-county area that encompasses the Indian River Lagoon from 1997 - 2001. By far, the largest percentage of bluefish (77.3%) are captured in coastal waters less than 3 miles from the shoreline, with many captures made from beaches and jetties. Inland waters other than the Indian River Lagoon accounted for 14.4% of the total, while the Indian River Lagoon harvest was less than half that (6.2%), and offshore waters to 200 miles accounted for only 2.1% of the harvest. Figure 3. Survey data for the bluefish recreational fishery showing the number of fishes harvested in East Florida waters from 1997 - 2004. Figure 4. Summary of the bluefish recreational harvest and percentage of total by area from 1997 - 2004. Table 4. Summary data for the bluefish, Pomatomus saltatrix, recreational fishery in Eastern Florida waters from 1997 - 2004. Data provided by National Marine Fisheries Service, Fisheries Statistics Division, NOAA. Table 5. By-county annual and cumulative percentages of the bluefish harvest for the years 1997 - 2001. Data provided by National Marine Fisheries Service, Fisheries Statistics Division, NOAA. Table 6. Summary of the bluefish recreational harvest and percentage of total fish captured in each area from 1997 - 2004. Data provided by National Marine Fisheries Service, Fisheries Statistics Division, NOAA. VII. REFERENCES Austin, H., D. Scoles, and A Abell. 1999. Morphometric separation of annual cohorts within mid-Atlantic bluefish, Pomatomus saltatrix, using discriminant function analysis. Fish. Bull. 97: 411-420. Bentley, T.B. and M.L. Wiley. 1982. Intra- and inter-specific variation in buoyancy of some estuarine fishes. Environ. Biol. Fishes 7(1):77-81. Deuel, D., J. Clark, and A. Mansueti. 1966. Description of embryonic and early larval stages of the bluefish, Pomatomus saltatrix. Trans. Am. Fish. Soc. 95(3):264-271. Graves, J., J. McDowell, A. Beardsley, and D. Scopes. 1993. Population genetic structure of the bluefish, Pomatomus saltatrix, in Atlantic coastal waters. Fish. Bull. 90:469-475. Hare, J. and R. Cowen. 1993. Ecological and evolutionary implications of the larval transport and reproductive strategy of bluefish, Pomatomus saltatrix. Mar. Ecol. Progr. Ser. 98:1-16. International Game Fish Association. 1991. World record game fishes. International Game Fish Association, Florida, USA. Kendall, A. and L. Walford. 1979. Sources and distribution of bluefish, Pomatomus saltatrix, larvae and juveniles off the east coast of the United States. Fish. Bull. 77(1):213-227. Lassiter, R.R. 1962. Life history aspects of the bluefish Pomatomus saltatrix, from the coast of north Carolina. M.S. Thesis. N.C. Stat University, Raleigh, NC. 103 pp. Lippson A.J. and R.L. Lippson. 1984. Life on the Chesapeake Bay. Johns Hopkins University Press, Baltimore, MD. 230 pp. Lippson A.J. and R.L. Moran. 1974. Manual for identification of early developmental stages of fishes of the Potomac River Estuary. Martin Marietta Corporation Environmental Technical Center Report. PPSP-MP-13. 282 pp. Lund, W.A. Jr. 1961. A racial investigation of the bluefish Pomatomus saltatrix of the Atlantic coast of North America. Bol. Inst. Oceanogr. Univ. Oriente Cumana (Venezuela), 1(1):73-129. Lund, W.A. Jr. and G.C. Maltezos. 1970. Movements and migrations of the bluefish Pomatomus saltatrix tagged in waters of New York and southern New England. Trans. Am. Fish. Soc. 99(4):719-725. Manooch, C.S. 1984. Fisherman's guide - fishes of the southeastern United States. N.C. State Museum of Natural History. Raleigh, NC. 362 pp. McBride, R. J. Ross, and D. Conover. 1993. Recruitment of bluefish Pomatomus saltatrix to estuaries of the U.S. South Atlantic Bight. Fish. Bull. 91:389-395. Muller, R.G. 2001. The 2000 update of the quota and stock assessment of bluefish, Pomatomus saltatrix, on Florida's Atlantic coast. Florida Fish and Wildlife Commission, Florida marine Research Institute, St. Petersburg, FL. 26 pp. Naughton, S. and C. Saloman. 1984. Food of the bluefish (Pomatomus saltatrix) from the U.S. south Atlantic and GOM. U.S. Department of Commerce, NOAA Technical Memo. NMFS-SEFC-150, 37 pp. Norcross, J.J., S.L. Richardson, W.H. Massmann, and E.B. Joseph. 1974. Development of young bluefish (Pomatomus saltatrix) and distribution of eggs and young in Virginia coastal waters. Trans. Am. Fish. Soc. 103(3):477-497. Oliver, J.D. M.J. Van Den Avyle, and E.L. Bozeman, Jr. 1989. Species Profiles: Life histories and Environmental Requirements of Coastal Fishes and invertebrates (South Atlantic): Bluefish. U.S. Fish and Wildlife Services Biological Report. 82(11.96), U.S. Army Corps of Engineers. TR EL-82-4. 23 pp. Olla, B.L., H.M. Katz, and A.L. Studholme. 1970. Prey capture and feeding motivation in the bluefish Pomatomus saltatrix. Copeia 1970(2):360-362. Olla, B.L. and A. L. Studholme. 1972. Daily and seasonal rhythms of activity in the bluefish Pomatomus saltatrix. Pages 303-326 in: H.E. Winn and B.L. Olla, eds. Behavior of Marine Animals: Recent Advances. Vol. 2, Chapter 8. Plenum Publishing Corp., New York, NY. Olla, B.L. and A. L. Studholme. 1975. Environmental stress and behavior: response capabilities of marine fishes. Pages 25-31 in: Second Joint U.S./U.S.S.R. symposium on the comprehensive analysis of the environment. Honolulu, HI, 21-26 October 1975. U.S. Environmental Protection Agency. Pottern, G., M. Huish and J. Kerby. 1989. Species profiles: life histories and environmental requirements of coastal fishes and invertebrates (mid Atlantic): Bluefish. U.S. Fish and Wildlife Service Biological Reports 82111.94. U.S. Army Corps of engineers, TR EL-82-4. 20 pp. Randall, J.E., 1995 Coastal fishes of Oman. University of Hawaii Press, Honolulu, Hawaii. 439 p. Richards, S.W. 1976. Age, growth and food of bluefish (Pomatomus saltatrix) from east-central Long Island Sound from July through November 1975. Trans. Am. Fish. Soc. 105(4):523-525. Smith, W. P. Berrien, and T. Potoff. 1994. Spawning patterns of bluefish, Pomatomus saltatrix, in the northeast continental shelf ecosystem. Bull. Mar. Sci. 54(1):8-16. Swanson, R.L. and C.J. Sinderman. 1979. Oxygen depletion and associated benthic mortalities in New York Bight, 1976. NOAA Prof. Papers 11. Wilk, S.J. 1977. Biological and fisheries data on bluefish Pomatomus saltatrix. U.S. National Marine Fisheries Service, Sandy Hook Laboratory, Highlands, NJ. Tech. Ser. Rep. 11. Report by: K. Hill, Smithsonian Marine Station Submit additional information, photos or comments to: irl_webmaster@si.edu Page last updated: May 26, 2005

B1: Volusia | C1: Brevard | D1: Indian River | E1: St. Lucie | F1: Martin | G1: Total
B2: Value | C2: Value | D2: Value | E2: Value | F2: Value | G2: Value
A3: YEAR | B3: ($) | C3: ($) | D3: ($) | E3: ($) | F3: ($) | G3: to IRL
A4: 1987 | B4: 2565 | C4: 9774 | D4: 10173 | E4: 95752 | F4: 151650 | G4: 269914
A5: 1988 | B5: 3470 | C5: 25640 | D5: 12804 | E5: 55211 | F5: 143829 | G5: 240954
A6: 1989 | B6: 3595 | C6: $0 | D6: $0 | E6: 55762 | F6: $0 | G6: 59357
A7: 1990 | B7: 2581 | C7: 24070 | D7: 20955 | E7: 91916 | F7: 102821 | G7: 242343
A8: 1991 | B8: 7516 | C8: 51214 | D8: 22632 | E8: 73813 | F8: 119101 | G8: 274276
A9: 1992 | B9: 2672 | C9: 31256 | D9: 47024 | E9: 40881 | F9: 114102 | G9: 235935
A10: 1993 | B10: 19071 | C10: 61420 | D10: 74289 | E10: 114217 | F10: 73331 | G10: 342328
A11: 1994 | B11: 11346 | C11: 13966 | D11: 42637 | E11: 103924 | F11: 133388 | G11: 305261
A12: 1995 | B12: 2155 | C12: 16533 | D12: 15913 | E12: 55115 | F12: 77720 | G12: 167436
A13: 1996 | B13: 194 | C13: 21381 | D13: 2537 | E13: 10294 | F13: 16869 | G13: 51275
A14: 1997 | B14: 523 | C14: 40677 | D14: 6573 | E14: 3966 | F14: 22027 | G14: 73766
A15: 1998 | B15: 2232 | C15: 30537 | D15: 3576 | E15: 53622 | F15: 30875 | G15: 120842
A16: 1999 | B16: 371 | C16: 57653 | D16: 3958 | E16: 28722 | F16: 6097 | G16: 96801
A17: 2000 | B17: 1392 | C17: 26391 | D17: 1567 | E17: 21614 | F17: 3053 | G17: 54017
A18: 2001 | B18: 1942 | C18: 15686 | D18: 1719 | E18: 17684 | F18: 6046 | G18: 43077
A19: Cumulative Totals: | B19: =SUM(B4:B18) -> 61625 | C19: =SUM(C4:C18) -> 426198 | D19: =SUM(D4:D18) -> 266357 | E19: =SUM(E4:E18) -> 822493 | F19: =SUM(F4:F18) -> 1000909 | G19: =SUM(G4:G18) -> 2577582

B1: Volusia | C1: Brevard | D1: Indian River | E1: St. Lucie | F1: Martin
B2: % | C2: % | D2: % | E2: % | F2: %
A3: YEAR | B3: Total | C3: Total | D3: Total | E3: Total | F3: Total
A4: 1987 | B4: 9.5030268900464596E-3 | C4: 3.6211534044177034E-2 | D4: 3.7689782671517597E-2 | E4: 0.35475003149151213 | F4: 0.56184562490274681
A5: 1988 | B5: 1.4401089004540285E-2 | C5: 0.10641035218340431 | D5: 5.3138773375831075E-2 | E5: 0.22913502162238436 | F5: 0.59691476381384001
A6: 1989 | B6: 6.056572940007076E-2 | C6: 0.0% | D6: 0.0% | E6: 0.93943427059992923 | F6: 0.0%
A7: 1990 | B7: 1.0650194146313283E-2 | C7: 9.9322035297078934E-2 | D7: 8.6468352706700835E-2 | E7: 0.37928060641322425 | F7: 0.42427881143668272
A8: 1991 | B8: 2.7403053858157476E-2 | C8: 0.18672432148638599 | D8: 8.2515422421210752E-2 | E8: 0.2691194271463781 | F8: 0.43423777508786771
A9: 1992 | B9: 1.1325153114205183E-2 | C9: 0.13247716532095705 | D9: 0.19930913175238943 | E9: 0.17327229957403523 | F9: 0.48361625023841315
A10: 1993 | B10: 5.5709728681264753E-2 | C10: 0.17941856932532541 | D10: 0.21701117057325139 | E10: 0.33364784650978008 | F10: 0.21421268491037834
A11: 1994 | B11: 3.7168193775162894E-2 | C11: 4.5751013067506167E-2 | D11: 0.13967391838459547 | E11: 0.34044309623568031 | F11: 0.4369637785370552
A12: 1995 | B12: 1.2870589359516472E-2 | C12: 9.8742205977209202E-2 | D12: 9.5039298597673141E-2 | E12: 0.32917054874698393 | F12: 0.46417735731861726
A13: 1996 | B13: 3.7835202340321793E-3 | C13: 0.41698683568990735 | D13: 4.9478303266699171E-2 | E13: 0.20076060458313019 | F13: 0.3289907362262311
A14: 1997 | B14: 7.089987257001871E-3 | C14: 0.55143290947048773 | D14: 8.9106092237616244E-2 | E14: 5.3764607000515142E-2 | F14: 0.29860640403437899
A15: 1998 | B15: 1.8470399364459378E-2 | C15: 0.25270187517584947 | D15: 2.9592360272090831E-2 | E15: 0.44373644924777811 | F15: 0.25549891593982227
A16: 1999 | B16: 3.8326050350719516E-3 | C16: 0.59558269026146426 | D16: 4.0888007355295915E-2 | E16: 0.29671181082840054 | F16: 6.2984886519767358E-2
A17: 2000 | B17: 2.5769665105429773E-2 | C17: 0.48856841364755538 | D17: 2.9009385934057795E-2 | E17: 0.40013329137123499 | F17: 5.6519243941722051E-2
A18: 2001 | B18: 4.508206235346008E-2 | C18: 0.36413863546672237 | D18: 3.9905285883418067E-2 | E18: 0.41052069549875803 | F18: 0.14035332079764143
A19: Totals: | B19: 2.3908065776374911E-2 | C19: 0.1653479889291592 | D19: 0.10333599474235931 | E19: 0.31909479504434779 | F19: 0.3883131555077588

B1: Volusia | C1: Brevard | D1: Indian River | E1: St. Lucie | F1: Martin
A2: Dollars | B2: 61625 | C2: 426198 | D2: 266357 | E2: 822493 | F2: 1000909
A3: % | B3: 2.3908065776374911E-2 | C3: 0.1653479889291592 | D3: 0.10333599474235931 | E3: 0.31909479504434779 | F3: 0.3883131555077588

B1: To 3 | C1: To 200 | D1: Other | E1: IRL | F1: TOTAL
B2: Miles | C2: Miles | D2: Inland
A3: 1997 | B3: 265892 | C3: 6721 | D3: 143790 | E3: 2228 | F3: 418632
A4: 1998 | B4: 258796 | C4: 1460 | D4: 30871 | E4: 27543 | F4: 318669
A5: 1999 | B5: 132467 | C5: 7699 | D5: 27056 | E5: 8733 | F5: 175955
A6: 2000 | B6: 215625 | C6: 18200 | D6: 71599 | E6: 26772 | F6: 332196
A7: 2001 | B7: 311201 | C7: 6667 | D7: 77779 | E7: 48462 | F7: 444111
A8: 2002 | B8: 506963 | C8: 14522 | D8: 49956 | E8: 62979 | F8: 634419
A9: 2003 | B9: 457417 | C9: 12681 | D9: 55742 | E9: 20847 | F9: 546688
A10: 2004 | B10: 387691 | C10: 2414 | D10: 14048 | E10: 6123 | F10: 410277
A11: Total: | B11: 2536052 | C11: 70364 | D11: 470841 | E11: 203687 | F11: 3280947

B1: To 3 | C1: To 200 | D1: Other | E1: IRL
B2: Miles | C2: Miles | D2: Inland
B3: % Total | C3: % Total | D3: % Total | E3: % Total
A4: 1997 | B4: 0.63514494830782164 | C4: 1.6054673316898853E-2 | D4: 0.34347589290832997 | E4: 5.3220967341244818E-3
A5: 1998 | B5: 0.81211539246051545 | C5: 4.5815564111978263E-3 | D5: 9.6874813678142518E-2 | E5: 8.6431375502480631E-2
A6: 1999 | B6: 0.75284589809894575 | C6: 4.3755505669063111E-2 | D6: 0.15376658804808047 | E6: 4.9632008183910656E-2
A7: 2000 | B7: 0.64908969403605099 | C7: 5.4786933015448708E-2 | D7: 0.21553239653698419 | E7: 8.0590976411516094E-2
A8: 2001 | B8: 0.70072797116036312 | C8: 1.5012012762575123E-2 | D8: 0.17513414439182998 | E8: 0.109121368306572
A9: 2002 | B9: 0.79909807240955899 | C9: 2.2890235002419535E-2 | D9: 7.874291280683586E-2 | E9: 9.9270356026537665E-2
A10: 2003 | B10: 0.8367057627019433 | C10: 2.3196046007960665E-2 | D10: 0.10196309412315617 | E10: 3.8133267970030436E-2
A11: 2004 | B11: 0.94494938785259719 | C11: 5.8838297052966658E-3 | D11: 3.4240281565868912E-2 | E11: 1.4924063498563166E-2

B1: To 3 Miles | C1: To 200 Miles | D1: Other Inland | E1: IRL
A2: No. Fish | B2: 2536052 | C2: 70364 | D2: 470841 | E2: 203687
A3: % | B3: 0.77296341574551497 | C3: 2.1446247074396508E-2 | D3: 0.14350765190659892 | E3: 6.20817709033398E-2