C1: I. TAXONOMY

A1: Back to Arthropoda | B1: Back to Animals | C1: Back to Alphabetized Species List | D1: Back to Expanded Species Reports

A1: Species Name: | B1: Penaeus duorarum
A2: Common Name: | B2: (Pink Shrimp)

A1: Kingdom | B1: Phylum/Division: | C1: Class: | D1: Order: | E1: Family: | F1: Genus:
A2: Animalia | B2: Arthropoda | C2: Malacostraca | D2: Decapoda | E2: Penaidae | F2: Penaeus

A1: Adult pink shrimp, Penaeus duorarum. Photo courtesy of the Southeast Chapter - American Littoral Society. | B1: Species Name: Penaeus duorarum (Burkenroad, 1939) Common Name: Northern pink shrimp; pink shrimp

A1: Species Description: Pink shrimp, like other members of the commercially important Penaeidae, can be distinguished from other families of shrimp due to their antennae, which are longer than their body lengths, and by their first three pairs of walking legs, which are chelate (Amos and Amos 1997). The integument is thin and translucent. Overall body color is highly variable, but generally gray, bluish or red-brown. The sides of the animal are somewhat flattened. The carapace has a medial carina that extends nearly to posterior end of carapace and is bordered by a broad, rounded groove on either side. The rostrum is somewhat thicker than in Penaeus aztecus and bears 6 - 7 sharp teeth on the dorsal surface. Ventrally, the rostrum may have 1- 3 teeth. The abdomen has 4 - 6 carinate segments, with the carina of the sixth segment ending in a spine. A dark, distinct spot on the pleural junction between the 3rd and 4th abdominal segments can be used to distinguish this species from other members of the genus. The tail is edged with blue coloration, and the telson has a deep medial groove. There is significant variation throughout the geographic range for a number of characteristics including the width of both the carina and its bordering groove; the number of external spines; and the number of pentasmal spines in males. The female thelycum is closed and is composed of 2 lateral plates and a medial protuberance. The male pentasma has distal ends that are curved and do not project free of the distolateral lobes on the ventral surface. Synonymy: None Other Taxonomic Groupings: Subphylum Crustacea Subclass Eumalocostraca Suborder Dendrobranchiata II. HABITAT AND DISTRIBUTION Regional Occurrence: Penaeus duorarum occurs in coastal waters and estuaries from the region around Chesapeake Bay south through the Florida Straits and the Gulf of Mexico to Cape Catoche and Isla Mujeres on the tip of the Yucatan Peninsula. IRL Distribution: Penaeus duorarum is an important commercial species that is distributed throughout the Indian River Lagoon. III. LIFE HISTORY AND POPULATION BIOLOGY Age, Size, Lifespan: Penaeus duorarum is sexually dimorphic, with large males attaining a length of 169 mm, and large females reaching over 280 mm (Williams 1984). Postlarvae that enter estuarine nursery grounds undergo rapid growth (Williams 1984), with growth rates slowing as shrimp age. During the warm summer months, young shrimp spawned in March or April were found to grow at approximately 7 mm per month, while older shrimp grew at approximately 5 mm per month. In large individuals (over 150 mm), growth per month is negligible (Iverson and Jones 1961). Individuals reaching sexual maturity may live a year or more. Aging shrimp based on body size, Eldred et al. (1961) estimated that a 140 mm individual was approximately 1 year old, and that a 200 mm individual was approximately 2 years old. Abundance: Penaeus duorarum can be highly abundant throughout its range. Documented centers of abundance for this species are along the West Coast of Florida, the southeastern Bay of Campeche, and the area around Beaufort, North Carolina. Locomotion: Pink shrimp actively swim, burrow and crawl. Reproduction: Undeveloped ovaries in Penaeus duorarum females are flaccid. As ovaries begin to mature, ova develop and grow larger. A nearly ripe stage is marked by ovaries becoming large and an opaque white color that is visible through the integument. When fully ripe, the ovary contains rod-like refractive bodies and takes on a blue-green color (Cummings 1961). In the region around Beaufort, North Carolina, the northernmost extent of the breeding range, roe-bearing females appear in commercial catches from May through July (Burkenroad 1949; Williams 1955), indicating that there is only one spawning season in this population. Further south, Cummings (1961) found that the Florida population of Penaeus duorarum was likely to spawn multiple times. In this population, peak spawning occurred from April through July; however, ripe females were also found at other times of the year. Spawning occurs at temperatures between 19 - 30°C, with increased activity taking place when temperatures are highest. As temperatures in Florida waters begin to cool in the fall, spawning activity shifts into deeper waters (Jones et al. 1970). Embryology: Shrimp weighing between 10.1 - 66. 8 g produce 44,000 - 534,000 eggs (Martosubroto 1974). Dobkin (1961) described egg and larval stages of P. duorarum. Eggs are an opaque yellow-brown in color and measure 0.31 - 0.33 mm in diameter. The hatching process takes approximately 2 - 3 minutes. There are 5 naupliar, 3 protozoeal, 3 mysid, and several postlarval stages. The recruitment period in North Carolina extends from April through December and peaks June - November (Williams 1969). Postlarvae entering estuaries for recruitment are much more abundant at night than during the day, and tend to occur in surface waters rather than deeper in the water column (Williams 1969). Lunar influences also affect postlarval distributions, with more postlarvae found entering estuaries on new moons than during full moons. IV. PHYSICAL TOLERANCES Temperature: Of the three closely related, commercially important penaeids (Penaeus aztecus, P. duorarum and P. setiferus), only P. duorarum is able to overwinter in estuaries in the northern portions of its range. Juveniles that overwinter in estuaries are subjected to temperatures as low as 3°C. In severe winters, many of these juveniles will be killed. Normally however, they typically survive the winter, though growth rates are significantly depressed. Greatest nocturnal activity rates are observed when temperatures are 26 - 27°C. (Fuss and Ogren 1966). Activity is decreased significantly below temperatures of 14° C and ceases at temperatures below 10°C. Winter burrowing enhances energy conservation in P. duorarum, and potentially increases the ability of an animal to withstand periods of starvation. Salinity: Young Penaeus duorarum are generally found in areas of higher salinity than its congeners P. aztecus and P. setiferus. Throughout Texas and Florida, P. duorarum is especially abundant in seagrass beds where salinity exceeds 20 ppt. P. duorarum possesses better osmoregulatory capabilities than either P. aztecus or P. setiferus; however, its regulatory ability is diminished at temperatures below 8° C. V. COMMUNITY ECOLOGY Trophic Mode: Penaeus duorarum is an opportunistic omnivore that consumes copepods, small mollusks, benthic diatoms, blue-green algae, filamentous green algae, detritus of vascular plants, bacterial films, slime molds and yeast (Odum and Heald 1972). Competitors: Penaeus duorarum is likely to compete with other penaeid shrimp and with fish for access to invertebrate prey. Habitats: Pink shrimp are typically found in both estuaries and inhabiting the inner littoral zone along coasts. Primary habitats for adults are sand, sand-shell, or coral-mud bottoms from the intertidal zone to 35 - 64 m in depth. In some areas, Penaeus duorarum can be found at depths of 330 - 365 m (Perez Farfante 1969). Major fisheries for this shrimp are located in areas where bottom sediments are composed primarily of calcareous mud and sand (Hildebrand 1954, 1955). In laboratory studies, (Williams 1958) sub-adults were observed to have a preference for sand-shell, and loose peat over other types of substrata offered such as sand, shell, muddy sand, etc. The youngest size classes of Penaeus duorarum seek out shallow, less saline areas in estuarine nursery habitats and are often found abundantly in seagrasses, with older shrimp more likely to utilize patchily distributed seagrass areas, and younger shrimp more likely to be found in areas with denser coverage (Murphey and Fonseca 1995; Sanchez 1997). As shrimp grow, they seek out progressively more saline areas, eventually migrating out of estuaries entirely and returning to offshore habitats. Burrow size in Penaeus duorarum is correlated with body size, with large shrimp (130 - 140 mm) burrowing to depths of 50 mm (Fuss 1964). Activity Time: Sub-adults and adults show pronounced diel activity patterns, remaining burrowed in the substratum during the daylight hours, and becoming active in the water column in the evening. Hughes (1968) demonstrated that emergence from the substratum is highly synchronized in Penaeus duorarum, with the transition of light into darkness being the primary zeitgeber. P. duorarum also becomes active in the water column in daylight under highly turbid conditions. Associated Species: Young Penaeus duorarum are often found in association with seagrasses and marine plants. In the Carolinas, the seagrasses Halodule beaudettei (formerly H. wrightii) and Zostera marina, are two of the dominant vegetation types. Throughout Florida and much of the Gulf of Mexico, Thalassia testudinum beds commonly contain pink shrimp. Parasites and diseases of P. duorarum were reviewed by Couch (1978). VI. SPECIAL STATUS Special Status: Commercially important. Fisheries Importance: On a national scale, Penaeus duorarum is one of the United States' most important commercial fishery species. The U.S. commercial harvest of wild-caught pink shrimp between the years 1987 - 2001 totaled 123.3 million metric tons, with a value of over $603.3 million (National Marine Fisheries Service database). The total commercial catch of pink shrimp in in Florida over the same time period was 98,300 metric tons, with a value of $492.8 million. However, the bulk of the catch was recorded from Florida's Gulf coast. Data show that approximately 95,700 metric tons of pink shrimp was harvested on Florida's Gulf coast, while 2,600 metric tons was harvested on Florida's east coast. The 5-county area of the IRL (Volusia, Brevard, Indian River, St. Lucie and Martin Counties), accounted for over 51% of the east coast total, with 2.4 million pounds harvested, with a commercial value over $6.2 million. Figure 1 below shows the dollar value of the pink shrimp fishery to IRL counties from 1987 - 2001. Figure 1. Annual dollar value of the commercial catch of pink shrimp to the 5-county area of the Indian River Lagoon. Figure 2. Total pink shrimp dollar value and percentage by county for the years 1987 - 2001. Table 1. Total dollar value of the IRL harvest of pink shrimp, Penaeus duorarum, between 1987 -2001. Table 2. By-county percentage of the pink shrimp harvest for the years 1987-2001. Table 3. By county cumulative dollar value and percentage of total for the IRL pink shrimp harvest from 1987 - 2001. VII. BIBLIOGRAPHY Amos, W.H. and S.H. Amos. 1997. National Audubon Society Nature Guides: Atlantic and Gulf Coasts. Alfred A. Knopf, Inc., New York, NY. Burkenroad, M.D. 1949. Occurrence and life histories of commercial shrimp. Science, 110(2869):688-689. Couch, J.A. 1978. Diseases, parasites, and toxic responses of commercial penaeid shrimps of the Gulf of Mexico and south Atlantic coasts of North America. Fish. Bull. 76(1):1-44. Cummings, W.C. 1961. Maturation and spawning of the pink shrimp Penaeus duorarum Burkenroad. Trans. Am. Fish. Soc., 90(4):462-468. Dobkin, S. 1961. Early developmental stages of pink shrimp, Penaeus duorarum, from Florida waters. U.S. Fish and Wild. Serv. Fish. Bull. 190, 61:i-iii, 321-349. Eldred, B., R.M. Ingle, K.D. Woodburn, et al. 1961. Biological observations on the commercial shrimp, Penaeus duorarum Burkenroad, in Florida waters. Florida State Board of Conservation Marine Laboratory, Professional Paper Series, 3, 139 pp. Fuss, C.M. 1964. Observations on burrowing behavior of the pink shrimp, Penaeus duorarum Burkenroad. Bull. Mar. Sci. of Gulf and Carib. 14(1):62-73. Fuss, C.M. and L.H. Ogren. 1966. Factors affecting activity and burrowing habits of the pink shrimp, Penaeus duorarum Burkenroad. Biol. Bull. 130(2):170-191. Hughes, D.A. 1968. Factors controlling emergence of pink shrimp (Penaeus duorarum) from the substrate. Biol. Bull. 134(1):48-59. Iverson, E.S. and A.C. Jones. 1961. Growth and migration of the Tortugas pink shrimp, Penaeus duorarum. Trans. Am. Fish. Soc. 89(1):1-8. Jones, A.C., D.E. Dimitriou, J.J. Ewald et al. 1970. Distribution of early developmental stages of pink shrimp, Penaeus duorarum, in Florida waters. Bull. Mar. Sci., 20(3):634-661. Martosubroto, P. 1974. Fecundity of pink shrimp, Penaeus duorarum Burkenroad. Bull. Mar. Sci., 24(3):606-627. Murphey, P.L. and M.S. Fonseca. 1995. Role of high and low energy seagrass beds as nursery areas for Penaeus duorarum in North Carolina. Mar. Ecol. Progr. Ser. 121:91-98. Odum, W.E. and E. Heald. 1972. Trophic analyses of an estuarine mangrove community. Bull. Mar. Sci. 22(3):671-738. Perez-Farfante, I. 1969. Western Atlantic shrimps of the genus Penaeus. Fish. Bull., 67(3):i-x, 461-591. Sanchez, A.J. 1997. Habitat preference of Penaeus duorarum Burkenroad (Crustacea: Decapoda) in a tropical coastal lagoon, southwest Gulf of Mexico. Journ. Exp. Mar. Biol. And Ecol. 217(1997):107-117. Williams, A.B. 1955. A contribution to the life histories of commercial shrimps (Penaeidae) in North Carolina. Bulletin of Marine Science of the Gulf and Caribbean 5(2):116-146. Williams, A.B. 1958. Substrates as a factor in shrimp distribution. Limnol. and Oceanogr. 3(3):283-290. Williams, A.B. 1969. A ten-year study of meroplankton in North Carolina estuaries: cycles of occurrence among penaeidean shrimps. Chesapeake Science 10(1):36-47. Williams, A.B. 1984. Shrimps, lobsters and crabs of the Atlantic coast of the eastern United States, Maine to Florida. Smithsonian Institution Press. Washington, D.C. 550 pp. Report by: K. Hill, Smithsonian Marine Station Submit additional information, photos or comments to: irl_webmaster@si.edu Page last updated: July 9, 2002

B1: Volusia | C1: Brevard | D1: Indian River | E1: St. Lucie | F1: Martin | G1: Total
B2: Value | C2: Value | D2: Value | E2: Value | F2: Value | G2: Value
A3: YEAR | B3: ($) | C3: ($) | D3: ($) | E3: ($) | F3: ($) | G3: to IRL
A4: 1987 | B4: $0 | C4: $0 | D4: $0 | E4: 20839 | F4: 80 | G4: =SUM(B4:F4) -> 20919
A5: 1988 | B5: $0 | C5: $0 | D5: 3288 | E5: 4950 | F5: $0 | G5: =SUM(B5:F5) -> 8238
A6: 1989 | B6: $0 | C6: $0 | D6: 13435 | E6: 24442 | F6: 5680 | G6: =SUM(B6:F6) -> 43557
A7: 1990 | B7: $0 | C7: $0 | D7: 4934 | E7: 126884 | F7: 2462 | G7: =SUM(B7:F7) -> 134280
A8: 1991 | B8: $0 | C8: 26629 | D8: 9908 | E8: 150866 | F8: 2145 | G8: =SUM(B8:F8) -> 189548
A9: 1992 | B9: $0 | C9: $0 | D9: 6209 | E9: 246599 | F9: 739 | G9: =SUM(B9:F9) -> 253547
A10: 1993 | B10: $0 | C10: $0 | D10: 1766 | E10: 351089 | F10: 220 | G10: =SUM(B10:F10) -> 353075
A11: 1994 | B11: $0 | C11: $0 | D11: 2426 | E11: 478418 | F11: $0 | G11: =SUM(B11:F11) -> 480844
A12: 1995 | B12: $0 | C12: 3636 | D12: 165 | E12: 273527 | F12: $0 | G12: =SUM(B12:F12) -> 277328
A13: 1996 | B13: $0 | C13: 25642 | D13: $0 | E13: 1042551 | F13: 2688 | G13: =SUM(B13:F13) -> 1070881
A14: 1997 | B14: $0 | C14: 35355 | D14: $0 | E14: 633023 | F14: 3127 | G14: =SUM(B14:F14) -> 671505
A15: 1998 | B15: $0 | C15: $0 | D15: $0 | E15: 428671 | F15: $0 | G15: =SUM(B15:F15) -> 428671
A16: 1999 | B16: $0 | C16: $0 | D16: $0 | E16: 688657 | F16: $0 | G16: =SUM(B16:F16) -> 688657
A17: 2000 | B17: $0 | C17: $0 | D17: $0 | E17: 884748 | F17: $0 | G17: =SUM(B17:F17) -> 884748
A18: 2001 | B18: $0 | C18: $0 | D18: $0 | E18: 715684 | F18: $0 | G18: =SUM(B18:F18) -> 715684
A19: Cumulative Totals: | B19: =SUM(B4:B18) -> $0 | C19: =SUM(C4:C18) -> 91262 | D19: =SUM(D4:D18) -> 42131 | E19: =SUM(E4:E18) -> 6070948 | F19: =SUM(F4:F18) -> 17141 | G19: =SUM(B19:F19) -> 6221482

B1: Volusia | C1: Brevard | D1: Indian River | E1: St. Lucie | F1: Martin
B2: % | C2: % | D2: % | E2: % | F2: %
A3: YEAR | B3: Total | C3: Total | D3: Total | E3: Total | F3: Total
A4: 1987 | B4: 0.0% | C4: 0.0% | D4: 0.0% | E4: 0.99617572541708499 | F4: 3.8242745829150534E-3
A5: 1988 | B5: 0.0% | C5: 0.0% | D5: 0.39912600145666421 | E5: 0.60087399854333579 | F5: 0.0%
A6: 1989 | B6: 0.0% | C6: 0.0% | D6: 0.30844640356314712 | E6: 0.56114975778864473 | F6: 0.13040383864820809
A7: 1990 | B7: 0.0% | C7: 0.0% | D7: 3.674411677092642E-2 | E7: 0.94492106047065838 | F7: 1.8334822758415251E-2
A8: 1991 | B8: 0.0% | C8: 0.14048684238293202 | D8: 5.227172009200836E-2 | E8: 0.79592504273323905 | F8: 1.1316394791820542E-2
A9: 1992 | B9: 0.0% | C9: 0.0% | D9: 2.4488556362331243E-2 | E9: 0.972596796649142 | F9: 2.914646988526782E-3
A10: 1993 | B10: 0.0% | C10: 0.0% | D10: 5.0017701621468524E-3 | E10: 0.99437513276216105 | F10: 6.2309707569213342E-4
A11: 1994 | B11: 0.0% | C11: 0.0% | D11: 5.0452953556662872E-3 | E11: 0.99495470464433367 | F11: 0.0%
A12: 1995 | B12: 0.0% | C12: 1.3110829054404893E-2 | D12: 5.9496336468008995E-4 | E12: 0.98629420758091502 | F12: 0.0%
A13: 1996 | B13: 0.0% | C13: 2.3944770707482903E-2 | D13: 0.0% | E13: 0.97354514647285739 | F13: 2.5100828196597006E-3
A14: 1997 | B14: 0.0% | C14: 5.265038979605513E-2 | D14: 0.0% | E14: 0.94269290623301394 | F14: 4.6567039709309683E-3
A15: 1998 | B15: 0.0% | C15: 0.0% | D15: 0.0% | E15: 1 | F15: 0.0%
A16: 1999 | B16: 0.0% | C16: 0.0% | D16: 0.0% | E16: 1 | F16: 0.0%
A17: 2000 | B17: 0.0% | C17: 0.0% | D17: 0.0% | E17: 1 | F17: 0.0%
A18: 2001 | B18: 0.0% | C18: 0.0% | D18: 0.0% | E18: 1 | F18: 0.0

B1: Volusia | C1: Brevard | D1: Indian River | E1: St. Lucie | F1: Martin
A2: Dollars | B2: 170141 | C2: 6070948 | D2: 42131 | E2: 91262 | F2: $0
A3: % | B3: 2.7347342642797971E-2 | C3: 0.97580415727313841 | D3: 6.7718591808189751E-3 | E3: 1.4668852212382837E-2 | F3: 0.0%