C1: I. TAXONOMY

A1: Back to Animals | B1: Back to Osteichthyes | C1: Back to Alphabetized Species List | D1: Back to Expanded Species Reports

A1: Species Name: | B1: Scomberomorus maculatus
A2: Common Name: | B2: (Spanish Mackerel)

A1: Kingdom | B1: Phylum/Division: | C1: Class: | D1: Order: | E1: Family: | F1: Genus:
A2: Animalia | B2: Chordata | C2: Osteichthyes | D2: Perciformes | E2: Scombridae | F2: Scomberomorus

A1: The Spanish Mackerel, Scomberomorus maculatus. Illustration by Diana Rome Peebles 1998. Courtesy of Florida Fish and Wildlife Conservation Commission, Division of Marine Fisheries. | B1: Species Name: Scomberomorus maculatus (Mitchill, 1815) Common Name: Spanish Mackerel, Atlantic Spanish mackerel Species Description: Scomberomorus cavalla, like other scombrid fishes, is elongate, compressed and fusiform. There are 2 dorsal fins, the first of which is triangular in shape and blue-black in color anteriorly. The second

A1: dorsal fin is greenish in color and concave, originating slightly in front of the anal fin, which is similarly shaped and equivalent in size. A series of 7 - 10 (usually 8) finlets lie posterior to both the second dorsal fin and the anal fin (Collette and Nauen 1983). The lateral line curves slightly downward towards the caudal peduncle. The caudal fin is high and lunate, with a narrow caudal peduncle that has a keel. The pectoral fins are relatively long and lack scales. Body color is typically dark blue to blue-green dorsally, silver laterally. The sides are marked with small, yellow to orange oblong spots above the lateral line. The pectoral fins are pale yellow with orange-brown edges, while the anal and ventral fins are white (Berrien and Finan 1977ab). Synonymy: Scomber maculates Mitchill, 1815; Cybium maculatum Cuvier, 1829 Potentially Misidentified Species: The Spanish mackerel is potentially confused with both the cero, Scomberomorus regalis, and the king mackerel, S. cavalla. It is easily distinguished from the king mackerel by its oblong yellowish spots above the lateral line, which does not curve downward at the second dorsal fin as is observed in king mackerel. The cero is distinguished from the Spanish mackerel by 1 - 2 thin, bronze-colored stripes that run mid-laterally along the body, and by scales on the pectoral fins, a feature absent from both Spanish and king mackerels (Collette and Nauen 1983). Meristic counts of some key identifying traits: II. HABITAT AND DISTRIBUTION Regional Occurrence: In the western Atlantic, Scomberomorus maculatus inhabits coastal waters from the Gulf of Maine to the Yucatan Peninsula (Collette et al. 1978; Godcharles and Murphy 1986). During the summer months, they are commonly found as far north as Chesapeake Bay, while in fall and winter, they are most common in the waters off central and southern Florida. Spanish mackerel typically come closer to beaches and enter the lower reaches of estuaries more often than do king mackerel (Godcharles and Murphy 1986). Spanish mackerel from as many as 6 geographic areas may mix in the waters off south Florida in the winter months, however, electrophoretic evidence suggests that the Atlantic and Gulf of Mexico populations spawn in the northern parts of their respective ranges, in isolation from other populations (Wollam 1970). Further, the Gulf population is distinct from Spanish mackerel captured along the eastern U.S. coast (Skow and Chittenden 1981). IRL Distribution: Though not considered common within the IRL, adult Spanish mackerel are sometimes observed around inlet areas. Juveniles may utilize seagrasses as nursery habitat. III. LIFE HISTORY AND POPULATION BIOLOGY Age, Size, Lifespan: Spanish mackerels live approximately 5-8 years (Kilma 1959; Powell 1975) and may weigh over 12 pounds. Males reach approximately 50 cm fork length (FL), while females reach 70 cm FL (Johnson et al. 1983; Godcharles and Murphy 1986). Powell (1975) reported that females grow faster than males, and that fish of the same age tend to be smaller in the Gulf of Mexico than in the South Atlantic. Schmidt et al. (1993) reported that females live longer and grow larger that males. Abundance: Spanish mackerels are not abundant inside the IRL except near inlet mouths; however, they are known to aggregate in large numbers in offshore waters and support a commercial fishery. Locomotion: Though scombrid fishes are known for high performance locomotion, data are limited on the precise mechanisms that enhance their swimming abilities. Thrust is generated with lift-based swimming whereby the narrow caudal peduncle and high, lunate caudal fin produce more than 90% of the thrust, with few significant lateral movements in other areas of the body. It has been hypothesized that the finlets on the posterior dorsal and ventral surfaces of scombrids aid locomotion, and may, in fact, be accessory locomotor structures that act to deflect water longitudinally to the area of the keels, where flow is then accelerated (Walters 1962). A study by Nauen and Lauder (2001) supported this hypothesis and showed that finlets do redirect cross-peduncle flow in the horizontal plane. Reproduction: Spanish mackerel have an extended spawning season (Powell 1975, Schmidt et al. 1993), with ripe females collected from April through September in Florida. Larvae are collected from May through September at locations between Cape Canaveral, Florida north to Cape Fear, North Carolina. Spawning season begins in April in the Carolinas, June in Chesapeake Bay, and August - September in New Jersey and New York (Earll, 1883). Water temperatures in excess of 25°C, and salinity between 30‰ 36 parts per thousand (ppt) are spawning triggers (Hoese 1907; Beaumariage 1970). Larval collection data indicate that spawning occurs at depths of 12-35 meters over the inner continental shelf (McEachran et al 1980). Female Spanish mackerel mature in Florida waters by approximately Age 1, when they reach 25 - 35 cm FL. Males mature at a slightly smaller size (Schmidt et al. 1993). Fecundity increases with increasing length and weight (Finucane and Collins unpublished in: Godcharles and Murphy 1986), with females between 35 - 66 cm FL producing between 194,000 to 1.5 million eggs. Embryology: Pelagic eggs measuring 0.9 - 1.3 mm in diameter are round and transparent, containing a single oil droplet. Hatching occurs approximately 25 hours after fertilization at water temperatures averaging 26°C (Smith 1907). Larvae and early juveniles grow 1.9 mm per day for approximately the first 23 days of life. From 23 - 40 days, growth is accelerated, with young fishes growing as much as 5 mm per day. Thereafter, growth slows to approximately 2.1 mm per day (Schmidt et al. 1993, Peters and Schmidt 1997). IV. PHYSICAL TOLERANCES Temperature: Earll (1883) reported that Spanish mackerel are rarely reported from waters cooler than 18°C. They are typically collected from waters ranging from 21 - 31 °C (70 - 88 °F). Water temperatures in excess of 25°C triggers spawning in Spanish mackerel (Hoese 1907; Beaumariage 1970). Temperature and salinity are governing factors in the geographic distribution of mackerels, with the northern range of Spanish mackerel extending to the 20°C isotherm within the 18m depth contour (Munro 1943; Berrien and Finian 1977a). Salinity: All life history stages of Spanish mackerel typically inhabit waters where salinity fluctuates between 32 - 36 ppt. (Godcharles and Murphy 1986). Spanish mackerel tend to avoid both freshwater and low salinity waters near river mouths (Earl 1883), though it has been documented that some juveniles inhabit waters where salinity has dropped below 18 ppt (Springer and Woodburn 1960). Juveniles are collected from low salinity (12.8 - 19.7 ppt) estuaries as well as from high salinity beaches, suggesting that at least some Spanish mackerel utilize estuaries as nursery grounds (Springer and Woodburn 1960). V. COMMUNITY ECOLOGY Trophic Mode: Spanish mackerel are schooling pelagic carnivores that feed primarily on estuarine-dependent species such as menhaden (Brevoortia sp.) and anchovies (Anchoa), with squid being the most prevalent invertebrate prey (Godcharles and Murphy 1986). Juveniles are primarily piscivorous, with anchovies, menhaden, Spanish sardines, and Atlantic thread herring constituting the bulk of the diet. Less common prey types are mullets (Mugil spp.) and sciaenids. Habitats: Typical habitat for Spanish mackerel includes surface waters of nearshore coastal waters and the lower reaches of tidal estuaries and bays where salinity tends to remain above 10 ppt. Typical depth distribution ranges from 10 - 35 meters (33 - 115 feet). Associated Species: Juvenile king mackerel sometimes mix with schools of Spanish mackerel (Godcharles and Murphy 1986). Larvae and juveniles of king mackerel are consumed as prey by species such as the little tunny (Euthynnus alletteratus) and dolphin (Coryphaena hippurus). Larger king mackerel are sought after by the little tunny, bottlenosed dolphin (Tursiops trucatus) (Cato and Prochaska 1976), and various shark species, including the tiger shark (Galeoverdo cuverie), bull shark (Carcharhinus leucas), and dusky shark (C. obscurus) (Bigelow and Schroeder 1948). VI. SPECIAL STATUS Special Status: None. Fisheries Importance: COMMERCIAL FISHERY: Florida accounts for 78% of the national commercial harvest of Spanish mackerel annually. The bulk of the commercial catch in east central Florida is taken between Cape Canaveral and Palm Beach, Florida (Klima 1959; Powell 1975). On the West coast of Florida, most of the catch is taken south of Tampa Bay and Ft. Myers. The statewide commercial catch of Spanish mackerel, Scomberomorus maculatus, between the years 1987 - 2001 was 65.0 million pounds, with a dollar value of over $28.0 million. Within the 5 county area encompassing the IRL (Volusia, Brevard, Indian River, St. Lucie and Martin Counties) the commercial catch of Scomberomorus maculatus accounts for approximately 57% of the statewide total, with a harvest of 37.1 million pounds, and a value in excess of $16.5 million. This ranks the Spanish mackerel eighth in commercial value within the IRL, and fourth in pounds harvested. Figure 1 below shows the dollar value of the Spanish mackerel fishery to IRL counties by year. As shown, commercial catch ranged from a low of $642,494 in 1992 to highs of over $1.3 million in 1988, 1993 and 1995. St. Lucie and Martin Counties in the southern portion of the IRL account for the bulk of the commercial harvest, with 45% and 27% of the catch respectively (Figure 2). After 1992, a significant portion of the harvest (21%) was taken off Brevard County. From 1987 - 2001, the annual dollar value to St. Lucie County ranged from $244,792 to $750554, averaging $488,167. In Martin County, the annual dollar amount ranged from $106,247 to $549,314, averaging $300,321; and in Brevard County, the annual dollar amount ranged from $18,823 to $568,467, averaging $232,685. Figure 1. Annual dollar value of the commercial catch of Spanish mackerel to the 5-county area of the Indian River Lagoon. Figure 2. Total Spanish mackerel dollar value and percentage by county for the years 1987 - 2001. Table 1. Total dollar value of IRL Spanish mackerel, Scomberomorus maculatus between 1987 - 2001. Table 2. By-county annual and cumulative percentages of the Spanish mackerel harvest for the years 1987-2001. Table 3. By-county cumulative dollar value and percentage of total for the Spanish mackerel harvest from 1987 - 2001. RECREATIONAL FISHERY: Spanish mackerel are also prized as an excellent recreation species. (NMFS 2005; Godcharles and Murphy 1986). Recreational anglers harvest Spanish mackerel seasonally throughout Florida's coastal zone, with the bulk of the catch taken in east central Florida, and along the Gulf coast (FWRI unpubl.). Total landings in Florida for Spanish mackerel in 2001 were 7.3 million pounds, with the recreational catch accounting for 59% of this total (FWRI unpbl.). The information below reflects angler survey information taken from the 5-county area that encompasses the Indian River Lagoon. Over 2 million Spanish mackerel, the bulk of the recreational harvest (73.5%), was taken in coastal waters from the shoreline to 3 miles offshore. Catches in waters 3 to 200 miles offshore account for 9.3% of the total recreational catch, while inland waters other than the Indian River Lagoon account for 8.0% of the catch. The Indian River Lagoon accounted for 9.2% of the total recreational harvest between 1997 and 2004, with approximately 256,000 Spanish mackerel captured. Figure 3. Survey data for the Spanish mackerel recreational fishery showing the number of fishes harvested in East Florida waters from 1997 - 2004. Figure 4. Summary of the Spanish mackerel recreational harvest and percentage of total by area from 1997 - 2004. Table 4. Summary data for the Spanish mackerel, Scomberomorus maculatus, recreational fishery in Eastern Florida waters from 1997 - 2004. Data provided by National Marine Fisheries Service, Fisheries Statistics Division, NOAA. Table 5. By-county annual and cumulative percentages of the Spanish mackerel harvest for the years 1997 - 2001. Data provided by National Marine Fisheries Service, Fisheries Statistics Division, NOAA. Table 6. Summary of the Spanish mackerel recreational harvest and percentage of total fish captured in each area from 1997 - 2004. Data provided by National Marine Fisheries Service, Fisheries Statistics Division, NOAA. VII. REFERENCES Beaumariage, D.S. 1973. Age, growth, and reproduction of king mackerel, Scomberomorus cavalla, in Florida: Fla. Mar. Res. Publ. 1. 45 pp. Berrien P. and D. Finan. 197a7. Biological and fisheries data on king mackerel, Scomberomorus cavalla (Cuvier). U.S. National Mariner Fisheries Service, Sandy Hook Laboratory, Highlands, NJ. Tech. Ser. Rep. 8. 40 pp. Berrien P. and D. Finan. 1977b. Biological and fisheries data on Spanish mackerel, Scomberomorus maculatus (Mitchill). U.S. National Mariner Fisheries Service, Sandy Hook Laboratory, Highlands, NJ. Tech. Ser. Rep. 9. 40 pp. Bigelow, H.B. and W.C. Schroeder. 1948. Fishes of the western north Atlantic (Lancets, cyclostomes, sharks). Sears Foundation for Marine Research, New Haven CT. 546 pp. Briggs, J.C. 1958. A list of Florida fishes and their distribution. Bull. Fla. State Mus. Biol. Sci. 2(8). 318 pp. Burns, K.M. 1981. Seasonal and areal distribution of scombrid larvae in the vicinity of Palm Beach, Florida. M.A. Thesis. University of South Florida. Tampa. 66 pp. Collette, B.B. and C.E. Nauen. 1983. FAO Species Catalog. Vol. 2. Scombrids of the World. An annotated and illustrated catalogue of tunas, mackerels, bonitos and related species known to date. FAO Fish. Synop. 125(2). 137 pp. Collette, B.B., J.L. Russo, and L.A. Zavala-Camin. 1978. Scomberomorus brasiliensis, a new species of Spanish mackerel from the western Atlantic. U.S. NMFS Fish. Bull. 76(1): 273-280. Dwinell, S.E. and C.R. Futch. 1973. Spanish and king mackerel larvae and juveniles in the northeastern Gulf of Mexico, June through October, 1969. Fla. Dep. Nat. Res. Mar. Res. Lab. Leafl. Serv. 4(24). 14 pp. Earll, R.E. 1883. The Spanish mackerel, Cybium maculatum (Mitch.), Ag.; its natural history and artificial propagation, with an account of its origin and development of the fishery. Rep. U.S. Comm. Fish Fish. (1880) pt. 8:395-424. Godcharles, M.F. and M.D. Murphy. 1986. Species Profiles: Life histories and environmental requirements of coastal fishes and invertebrates (South Florida) King mackerel and Spanish mackerel. U.S. Fish and Wildlife Service Biological Reports. 82(11.58). U.S Army Corps of Engineers, TR EL-82-4. 18 pp. Hoese, H.D. 1965. Spawning of marine fishes in the Port Aransas, Texas, area as determined by the distribution of young and larvae. Ph. D. Diss. Univer. Texas, Austin. 144 pp. Johnson, A.G., W.A. Fable Jr., M.L. Williams, and L.E. Barger. 1983. Age, growth and mortality of king mackerel , Scomberomorus cavalla, from the Southeastern United States. U.S. NMFS Fish. Bull. 81(1):97-106. Klima, E.F. 1959. Aspects of the biology and fishery for Spanish mackerel, Scomberomorus maculatus (Mitchell), of southern Florida. Fla. Board Conserv. Mar. Res. Lab. Tech. Ser. 27. 39 pp. McEachran, J.D. , J.H. Finucane and L.S. Hall. 1980. Distribution, seasonality and abundance of king and Spanish mackerel larvae in the northwestern Gulf of Mexico (Pisces: Scombridae). Northeast Gulf Sci. 4(1):1-16. Muro, I.S.R. 1943. Revisions of Australian species of Scomberomorus. Mem. Queensl. Mus. 12(21):65-69. Nauen, J.C. and G.V. Lauder. 2001. Locomotion in scombrid fishes: visualization of flow around the caudal peduncle and finlets of the chub mackerel Scomber japonicus. Journal of Experimental Biology. 204:2251-2263. Naughton, S.P. and C.H. Saloman. 1981. Stomach contents of juveniles of king mackerel (Scombromorus cavalla) and Spanish mackerel (S. maculatus). Northeast Gulf Sci. 5(1):71-74. Peters, J.S. and D.J. Schmidt. 1997. Daily age and growth of larval and early juvenile Spanish mackerel, Scomberomorus maculatus, from the South Atlantic Bight. Fish. Bull. 95(3): 530-539. Powell, D. 1975. Age, growth and reproduction in Florida stocks of Spanish mackerel, Scomberomus, maculatus. Fla. Mar. Res. Publ. 5. 21 pp. Schmidt, D.S., M.R. Collins, and D.M. Wyanski. 1993. Age, growth and reproductive biology of Spanish Mackerel, Scomberomorus maculatus, for the Atlantic Coast of the southeastern U.S. Fish. Bull. 91:526-533. Skow,L.C. and M.E. Chittenden Jr. 1981. Difference in hemoglobin phenotypes among Spanish mackerel, Scomberomorus maculatus. Northeast Gulf Sci. 5(1):67-70. Smith, H.M. 1907. The fishes of North Carolina. N.C. Geol. Econ. Surv. 2. 433 pp. Springer, V.G. and K.D. Woodburn, 1960. An ecological study of the fishes of the Tampa Bay area. Fla. Board Conserv. Mar. Res. Lab. Prof. Pap. Ser. 1. 104 pp. Walters, V. 1962. Body form and swimming performance in the scombrid fishes. Am. Zool. 2:143-149. Williams, R.O. and R. G. Taylor. 1978. King mackerel tagging and stock assessment study (unpl.) Completion report to Natl. Marine Fisheries Service, Florida DNR. PL 88-309: Project No. 2-254-r. 70 pp. Williams, R.O. and R. G. Taylor. 1980. The effect of water temperature and winter air temperature on springtime migrations of king mackerel in the vicinity of Tampa Bay, Florida. Fla. Sci. 43(suppl):26. (abstr). Wollam, M.B. 1970. Description and distribution of larvae and early juveniles of king mackerel, Scomberomorus cavalla (Cuvier), and Spanish mackerel, S. maculatus (Mitchill); (Pisces:Scombridae); in the Western North Atlantic.Fla. Dept. Nat. Res. Lab. Tech. Serv. 61. 35 pp. Report by: K. Hill, Smithsonian Marine Station Submit additional information, photos or comments to: irl_webmaster@si.edu Page last updated: March 10, 2005

B1: King Mackerel: | C1: Spanish Mackerel: | D1: Cero:
A2: # Vertebrae | B2: 41-43 | C2: 52-53 | D2: 47-49
A3: Dorsal Spines: | B3: 12-18 | C3: 17-19 | D3: 16-18
A4: Dorsal Rays: | B4: 15-18 | C4: 17-20 | D4: 16-19
A5: Anal Rays: | B5: 16-20 | C5: 17-20 | D5: 15-20
A6: Pectoral Fin Rays: | B6: 21-23 | C6: 20-23 | D6: 20-24
A7: Gill Rakers (lower limb): | B7: 6-10 | C7: 8-13 | D7: 10-14

B1: VOLUSIA | C1: BREVARD | D1: INDIAN | E1: ST. | F1: MARTIN | G1: TOTAL
D2: RIVER | E2: LUCIE
B3: Value | C3: Value | D3: Value | E3: Value | F3: Value | G3: Value
A4: YEAR | B4: ($) | C4: ($) | D4: ($) | E4: ($) | F4: ($) | G4: to IRL
A5: 1987 | B5: 1176 | C5: 18823 | D5: 8891 | E5: 648373 | F5: 516041 | G5: =SUM(B5:F5) -> 1193304
A6: 1988 | B6: 3675 | C6: 50306 | D6: 16171 | E6: 750554 | F6: 549314 | G6: =SUM(B6:F6) -> 1370020
A7: 1989 | B7: 3443 | C7: 38172 | D7: 45624 | E7: 831609 | F7: 251029 | G7: =SUM(B7:F7) -> 1169877
A8: 1990 | B8: 7299 | C8: 88667 | D8: 110907 | E8: 377894 | F8: 203108 | G8: =SUM(B8:F8) -> 787875
A9: 1991 | B9: 3272 | C9: 346141 | D9: 129558 | E9: 666858 | F9: 106247 | G9: =SUM(B9:F9) -> 1252076
A10: 1992 | B10: 4211 | C10: 117273 | D10: 69490 | E10: 256475 | F10: 195045 | G10: =SUM(B10:F10) -> 642494
A11: 1993 | B11: 13593 | C11: 198376 | D11: 63476 | E11: 525208 | F11: 526319 | G11: =SUM(B11:F11) -> 1326972
A12: 1994 | B12: 10093 | C12: 172552 | D12: 58940 | E12: 402688 | F12: 553714 | G12: =SUM(B12:F12) -> 1197987
A13: 1995 | B13: 31300 | C13: 251418 | D13: 82746 | E13: 464227 | F13: 531578 | G13: =SUM(B13:F13) -> 1361269
A14: 1996 | B14: 203 | C14: 273010 | D14: 117162 | E14: 452111 | F14: 252445 | G14: =SUM(B14:F14) -> 1094931
A15: 1997 | B15: 157 | C15: 509090 | D15: 86836 | E15: 371833 | F15: 118755 | G15: =SUM(B15:F15) -> 1086671
A16: 1998 | B16: 228 | C16: 568467 | D16: 41672 | E16: 457931 | F16: 147133 | G16: =SUM(B16:F16) -> 1215431
A17: 1999 | B17: 439 | C17: 362295 | D17: 62654 | E17: 374257 | F17: 117856 | G17: =SUM(B17:F17) -> 917501
A18: 2000 | B18: 172 | C18: 301055 | D18: 96150 | E18: 244792 | F18: 170505 | G18: =SUM(B18:F18) -> 812674
A19: 2001 | B19: 1140 | C19: 194628 | D19: 97433 | E19: 497699 | F19: 265728 | G19: =SUM(B19:F19) -> 1056628
A20: Cumulative Totals: | B20: =SUM(B5:B19) -> 80401 | C20: =SUM(C5:C19) -> 3490273 | D20: =SUM(D5:D19) -> 1087710 | E20: =SUM(E5:E19) -> 7322509 | F20: =SUM(F5:F19) -> 4504817 | G20: =SUM(B20:F20) -> 16485710

B1: VOLUSIA | C1: BREVARD | D1: INDIAN | E1: ST. | F1: MARTIN
D2: RIVER | E2: LUCIE
B3: % | C3: % | D3: % | E3: % | F3: %
A4: YEAR | B4: Total | C4: Total | D4: Total | E4: Total | F4: Total
A5: 1987 | B5: 9.8549908489370679E-4 | C5: 1.5773851424280821E-2 | D5: 7.4507418059438337E-3 | E5: 0.54334268551852671 | F5: 0.43244722216635495
A6: 1988 | B6: 2.6824425920789477E-3 | C6: 3.6719171982890764E-2 | D6: 1.1803477321498956E-2 | E6: 0.54784163734835989 | F6: 0.40095327075517145
A7: 1989 | B7: 2.9430444397146025E-3 | C7: 3.2629071261337732E-2 | D7: 3.8998971686767067E-2 | E7: 0.71085165363538216 | F7: 0.21457725897679841
A8: 1990 | B8: 9.2641599238457873E-3 | C8: 0.11253942567031572 | D8: 0.14076725368871965 | E8: 0.47963699825479933 | F8: 0.25779216246231951
A9: 1991 | B9: 2.6132598979614658E-3 | C9: 0.27645366575191921 | D9: 0.10347454946824314 | E9: 0.53260185483948264 | F9: 8.4856670042393598E-2
A10: 1992 | B10: 6.5541468091530816E-3 | C10: 0.18252777457843963 | D10: 0.10815665204655607 | E10: 0.39918660719010607 | F10: 0.30357481937574515
A11: 1993 | B11: 1.0243622322098732E-2 | C11: 0.14949524179862123 | D11: 4.7835221843414932E-2 | E11: 0.39579433477119336 | F11: 0.39663157926467174
A12: 1994 | B12: 8.424966214157583E-3 | C12: 0.14403495196525504 | D12: 4.9199198321851573E-2 | E12: 0.33613720349219151 | F12: 0.46220368000654433
A13: 1995 | B13: 2.2993251150213515E-2 | C13: 0.18469384082058726 | D13: 6.0785928424139532E-2 | E13: 0.34102517577348784 | F13: 0.39050180383157185
A14: 1996 | B14: 1.8539981058167136E-4 | C14: 0.24933991274336009 | D14: 0.10700400299196935 | E14: 0.41291277715216756 | F14: 0.2305579073019213
A15: 1997 | B15: 1.4447795146829169E-4 | C15: 0.46848586186619501 | D15: 7.9910110787901764E-2 | E15: 0.34217624285547327 | F15: 0.10928330653896165
A16: 1998 | B16: 1.8758777750444081E-4 | C16: 0.46770816278340771 | D16: 3.4285780105987096E-2 | E16: 0.37676429184379862 | F16: 0.12105417748930215
A17: 1999 | B17: 4.7847359294431288E-4 | C17: 0.39487150422724338 | D17: 6.8287663991646874E-2 | E17: 0.40790909219717469 | F17: 0.12845326599099074
A18: 2000 | B18: 2.1164698267694057E-4 | C18: 0.37044989749887408 | D18: 0.11831312432783625 | E18: 0.30121795455496297 | F18: 0.20980737663564972
A19: 2001 | B19: 1.0789038337049557E-3 | C19: 0.18419727661958607 | D19: 9.2211260727521893E-2 | E19: 0.4710257536237919 | F19: 0.25148680519539518

B1: Volusia | C1: Brevard | D1: Indian River | E1: St. Lucie | F1: Martin
A2: Dollars | B2: 80401 | C2: 3490273 | D2: 1087710 | E2: 7322509 | F2: 4504817
A3: % | B3: 4.8770116664675041E-3 | C3: 0.21171505503857582 | D3: 6.5978959959868272E-2 | E3: 0.44417310507099783 | F3: 0.27325586826409054

B1: To 3 | C1: To 200 | D1: Other | E1: IRL | F1: TOTAL
B2: Miles | C2: Miles | D2: Inland
A3: 1997 | B3: 126875 | C3: 24538 | D3: 79264 | E3: 8554 | F3: 239230
A4: 1998 | B4: 129413 | C4: 29799 | D4: 20551 | E4: 29110 | F4: 208873
A5: 1999 | B5: 217942 | C5: 26057 | D5: 7828 | E5: 18723 | F5: 270550
A6: 2000 | B6: 359654 | C6: 30898 | D6: 32288 | E6: 22608 | F6: 445447
A7: 2001 | B7: 233973 | C7: 17158 | D7: 16302 | E7: 68969 | F7: 336402
A8: 2002 | B8: 399279 | C8: 52503 | D8: 10674 | E8: 64237 | F8: 526693
A9: 2003 | B9: 403441 | C9: 41903 | D9: 42657 | E9: 31269 | F9: 519271
A10: 2004 | B10: 179879 | C10: 37328 | D10: 13996 | E10: 12181 | F10: 243384
A11: Total: | B11: 2050456 | C11: 260184 | D11: 223560 | E11: 255651 | F11: 2789850

B1: To 3 | C1: To 200 | D1: Other | E1: IRL
B2: Miles | C2: Miles | D2: Inland
B3: % Total | C3: % Total | D3: % Total | E3: % Total
A4: 1997 | B4: 0.53034736446097897 | C4: 0.10257074781590937 | D4: 0.33132968273209884 | E4: 3.5756385068762282E-2
A5: 1998 | B5: 0.61957744658237301 | C5: 0.14266563892891854 | D5: 9.8389930723453964E-2 | E5: 0.1393669837652545
A6: 1999 | B6: 0.80555165403807061 | C6: 9.631121788948438E-2 | D6: 2.8933653668453151E-2 | E6: 6.9203474403991869E-2
A7: 2000 | B7: 0.80740020698309789 | C7: 6.9364032084625105E-2 | D7: 7.2484493104679124E-2 | E7: 5.0753512763583544E-2
A8: 2001 | B8: 0.69551607897693835 | C8: 5.1004453005630168E-2 | D8: 4.8459878359819498E-2 | E8: 0.20501958965761202
A9: 2002 | B9: 0.75808677920534351 | C9: 9.9684256293514434E-2 | D9: 2.0266075303829744E-2 | E9: 0.12196288919731228
A10: 2003 | B10: 0.77693728322975864 | C10: 8.0695821642263868E-2 | D10: 8.2147857284539286E-2 | E10: 6.021711206672431E-2
A11: 2004 | B11: 0.73907487755974099 | C11: 0.15337080498307201 | D11: 5.7505834401604047E-2 | E11: 5.0048483055582946E-2

B1: To 3 Miles | C1: To 200 Miles | D1: Other Inland | E1: IRL
A2: No. Fish | B2: 2050456 | C2: 260184 | D2: 223560 | E2: 255651
A3: % | B3: 0.73496998046489959 | C3: 9.3260928006882085E-2 | D3: 8.0133340502177533E-2 | E3: 9.1636109468250987E-2